{
  "dcp_version": "2.0",
  "intent_id": "intent:v2-email-gen-001",
  "session_nonce": "a0f170f5da399c85fb454c1194b0650475d3b55e2068eaafe263cf4aa90630c8",
  "decision": "approve",
  "risk_score": 150,
  "reasons": [
    "Low-risk action",
    "Known recipient domain"
  ],
  "required_confirmation": null,
  "applied_policy_hash": "sha256:9b65ceff8e84ad5cbfd63b62f3b4330ab40005e218d9ae8dae2e9b9e1d9f16e6",
  "timestamp": "2026-03-01T12:00:01Z",
  "resolved_tier": "standard"
}